"url","date","title","director","writer","stars","running_time","genre","rating","blurb"
"https://www.nytimes.com/2018/11/01/movies/maria-by-callas-review.html","2018/11/01","Maria by Callas","Tom Volf","Fanny Ardant, Joyce DiDonato, Maria Callas, Aristotle Onassis, Vittorio De Sica","PG","Documentary, Biography","NA","1h 53m","Rated PG. In English, French and Italian, with English subtitles."
"https://www.nytimes.com/2018/11/01/movies/bodied-review.html","2018/11/01","Bodied","Joseph Kahn","Alex Larsen","Calum Worthy, Jackie Long, Rory Uphold, Jonathan Park, Walter Perez","2 hours","Comedy, Drama, Music","R","Rated R for, you got it, language."
"https://www.nytimes.com/2018/10/31/movies/the-nutcracker-and-the-four-realms-review.html","2018/10/31","The Nutcracker and the Four Realms","Lasse Hallström, Joe Johnston","Ashleigh Powell","Mackenzie Foy, Keira Knightley, Morgan Freeman, Helen Mirren, Tom Sweet","1h 39m","Adventure, Family, Fantasy","PG","Rated PG."
"https://www.nytimes.com/2018/11/02/movies/nobodys-fool-review-tyler-perry-tiffany-haddish.html","2018/11/02","Nobody's Fool","Tyler Perry","Tyler Perry","Tiffany Haddish, Courtney Henggeler, Missi Pyle, Whoopi Goldberg, Tika Sumpter","1h 50m","Comedy, Drama","R","Rated R for sex and drug use and lots and lots and lots of profanity."
"https://www.nytimes.com/2018/11/01/movies/a-private-war-review.html","2018/11/01","A Private War","Matthew Heineman","Arash Amel","Rosamund Pike, Jamie Dornan, Stanley Tucci, Tom Hollander, Faye Marsay","1h 46m","Biography, Drama, War","R","Rated R for bombs, blood and a bit of nudity."
"https://www.nytimes.com/2018/11/01/movies/the-other-side-of-the-wind-review-orson-welles.html","2018/11/01","The Other Side of the Wind","Orson Welles","Oja Kodar, Orson Welles","John Huston, Robert Random, Peter Bogdanovich, Susan Strasberg, Oja Kodar","2h 2m","Comedy, Drama","R","Rated R for female nudity and gun play."
"https://www.nytimes.com/2018/11/05/movies/the-front-runner-review-gary-hart.html","2018/11/05","The Front Runner","Jason Reitman","Matt Bai, Jay Carson, Jason Reitman","Hugh Jackman, Vera Farmiga, J.K. Simmons, Mark O'Brien, Molly Ephraim","1h 53m","Biography, Drama","R","Rated R. Swearing, smoking, and speculation about sex."
"https://www.nytimes.com/2018/11/08/movies/weightless-review.html","2018/11/08","Weightless","Jaron Albertin","Enda Walsh","Marc Menchaca, Julianne Nicholson, Siobhan Fallon Hogan, Alessandro Nivola, Johnny Knoxville","1h 33m","Drama","R","Rated R."
"https://www.nytimes.com/2018/11/08/movies/the-long-dumb-road-review.html","2018/11/08","The Long Dumb Road","Hannah Fidell","Hannah Fidell, Carson Mell","Taissa Farmiga, Casey Wilson, Jason Mantzoukas, Ron Livingston, Grace Gummer","1h 30m","Comedy","R","Rated R. Road brews."
"https://www.nytimes.com/2018/11/08/movies/the-ballad-of-buster-scruggs-review.html","2018/11/08","The Ballad of Buster Scruggs","Ethan Coen, Joel Coen","Joel Coen, Ethan Coen","Liam Neeson, James Franco, Zoe Kazan, David Krumholtz, Clancy Brown","2h 12m","Comedy, Drama, Musical, Mystery, Romance, Western","R","Rated R. A lot of killing."
"https://www.nytimes.com/2018/11/07/movies/the-grinch-review.html","2018/11/07","The Grinch","Yarrow Cheney, Scott Mosier","Michael LeSieur, Tommy Swerdlow","Rashida Jones, Tristan O'Hare, Scarlett Estevez, Benedict Cumberbatch, Angela Lansbury","1h 30m","Animation, Comedy, Family, Fantasy","PG","Rated PG for “some crude humor” and perhaps because it might inspire youngsters to explore Tyler, th"
"https://www.nytimes.com/2018/11/08/movies/here-and-now-review.html","2018/11/08","Here and Now","Fabien Constant","Laura Eason","Sarah Jessica Parker, Renée Zellweger, Taylor Kinney, Simon Baker, Common","1h 31m","Drama, Music, Romance","R","Rated R for language and some sex in the city."
"https://www.nytimes.com/2018/11/07/movies/the-girl-in-the-spiders-web-review.html","2018/11/07","The Girl in the Spider's Web: A New Dragon Tattoo Story","Fede Alvarez","Jay Basu, Fede Alvarez, Steven Knight","Claire Foy, Sylvia Hoeks, Lakeith Stanfield, Stephen Merchant, Cameron Britton","1h 57m","Crime, Drama, Thriller","R","Rated R for extreme violence, including intimations of child rape."
"https://www.nytimes.com/2018/11/08/movies/overlord-review.html","2018/11/08","Overlord","Julius Avery","Billy Ray, Mark L. Smith","Jovan Adepo, Wyatt Russell, Mathilde Ollivier, Pilou Asbæk, John Magaro","1h 49m","Action, Horror, Mystery, Sci-Fi, Thriller, War","R","Rated R for copious swearing, bleeding and burning. And one very nasty head crush."
"https://www.nytimes.com/2018/11/08/movies/outlaw-king-review.html","2018/11/08","Outlaw King","David Mackenzie","Bathsheba Doran, David Mackenzie, James MacInnes","Chris Pine, Stephen Dillane, Rebecca Robin, Billy Howle, Paul Blair","2h 1m","Action, Biography, Drama, History","R","Rated R for extreme medieval violence."
"https://www.nytimes.com/2018/11/15/movies/at-eternitys-gate-review.html","2018/11/15","At Eternity's Gate","Julian Schnabel","Jean-Claude Carrière, Louise Kugelberg, Julian Schnabel","Willem Dafoe, Rupert Friend, Oscar Isaac, Mads Mikkelsen, Mathieu Amalric","1h 50m","Biography, Drama","PG-13","Rated PG-13 for some violence. In French and English, with English subtitles."
"https://www.nytimes.com/2018/11/15/movies/green-book-review.html","2018/11/15","Green Book","Peter Farrelly","Nick Vallelonga, Brian Hayes Currie, Peter Farrelly","Linda Cardellini, Viggo Mortensen, Mahershala Ali, Don Stark, Sebastian Maniscalco","2h 10m","Biography, Comedy, Drama","PG-13","Rated PG-13. Some mean white people, but they’re not all like that."
"https://www.nytimes.com/2018/11/15/movies/widows-review.html","2018/11/15","Widows","Steve McQueen","Gillian Flynn, Steve McQueen","Viola Davis, Michelle Rodriguez, Elizabeth Debicki, Liam Neeson, Jon Bernthal","2h 9m","Crime, Drama, Romance, Thriller","R","Rated R. Blood and thunder."
"https://www.nytimes.com/2018/11/15/movies/under-the-wire-review-marie-colvin.html","2018/11/15","Under The Wire","Chris Martin","Ziad Abaza, Janine Birkett, Julian Lewis Jones, Karine Myriam Lapouble, Nathan Dean Williams","R","Documentary","NA","1h 35m","Rated R for broken bodies and exploding bombs."
"https://www.nytimes.com/2018/11/15/movies/instant-family-review.html","2018/11/15","Instant Family","Sean Anders","Sean Anders, John Morris","Mark Wahlberg, Rose Byrne, Isabela Moner, Gustavo Quiroz, Julianna Gamiz","1h 59m","Comedy, Drama","PG-13","Rated PG-13."
"https://www.nytimes.com/2018/11/20/movies/roma-review.html","2018/11/20","Roma","Alfonso Cuarón","Alfonso Cuarón","Yalitza Aparicio, Marina de Tavira, Diego Cortina Autrey, Carlos Peralta, Marco Graf","2h 15m","Drama","R","Rated R. In Spanish, with English subtitles."
"https://www.nytimes.com/2018/11/21/movies/the-favourite-review.html","2018/11/21","The Favourite","Yorgos Lanthimos","Deborah Davis, Tony McNamara","Olivia Colman, Emma Stone, Rachel Weisz, Nicholas Hoult, Emma Delves","1h 59m","Biography, Drama","R","Rated R. Naughty lords and ladies."
"https://www.nytimes.com/2018/11/22/movies/shoplifters-review.html","2018/11/22","Shoplifters","Hirokazu Koreeda","Hirokazu Koreeda","Kirin Kiki, Lily Franky, Moemi Katayama, Sôsuke Ikematsu, Sakura Andô","2h 1m","Crime, Drama","R","Rated R for sex-club work. In Japanese, with English subtitles."
"https://www.nytimes.com/2018/11/29/movies/mirai-review.html","2018/11/29","Mirai","Mamoru Hosoda","Mamoru Hosoda","Haru Kuroki, Moka Kamishiraishi, Gen Hoshino, Kôji Yakusho, Kumiko Asô","1h 38m","Animation, Adventure, Drama, Family, Fantasy","PG","Rated PG for jealous older brothers and mild ontological unease. In Japanese, with English subtitles"
"https://www.nytimes.com/2018/11/29/movies/anna-and-the-apocalypse-review.html","2018/11/29","Anna and the Apocalypse","John McPhail","Alan McDonald, Ryan McHenry","Ella Hunt, Malcolm Cumming, Sarah Swire, Christopher Leveaux, Ben Wiggins","1h 37m","Comedy, Fantasy, Horror, Musical","R","Rated R for the usual zombieland blood and guts."
"https://www.nytimes.com/2018/11/28/movies/mowgli-legend-of-the-jungle-review.html","2018/11/28","Mowgli: Legend of the Jungle","Andy Serkis","Callie Kloves","Christian Bale, Benedict Cumberbatch, Cate Blanchett, Tom Hollander, Andy Serkis","1h 44m","Adventure, Drama","PG-13","Rated PG-13 for violence, dirt, blood, death and other gritty material."
"https://www.nytimes.com/2018/11/29/movies/elliot-the-littlest-reindeer-review.html","2018/11/29","Elliot the Littlest Reindeer","Jennifer Westcott","Jennifer Westcott","Morena Baccarin, Josh Hutcherson, John Cleese, Martin Short, Christopher Jacot","1h 29m","Animation, Family","PG","Rated PG. Mendacious elves."
"https://www.nytimes.com/2018/11/29/movies/the-possession-of-hannah-grace-review.html","2018/11/29","The Possession of Hannah Grace","Diederik Van Rooijen","Brian Sieve","Shay Mitchell, Grey Damon, Kirby Johnson, Nick Thune, Louis Herthum","1h 25m","Horror, Mystery, Thriller","R","Rated R for gruesome images and undead nudity."
"https://www.nytimes.com/2018/11/29/movies/happy-as-lazzaro-review.html","2018/11/29","Happy as Lazzaro","Alice Rohrwacher","Alice Rohrwacher","Adriano Tardiolo, Agnese Graziani, Luca Chikovani, Alba Rohrwacher, Sergi López","2h 5m","Drama","PG-13","Rated PG-13. Treachery and wickedness. In Italian, with English subtitles."
